{
  "type": "feasibility",
  "spec_id": "SPEC-128",
  "verdict": "ok",
  "note": "repo graph read at 8f21c4 · every write stays inside the three packages the spec names",
  "returned_by": {
    "agent_label": "Harness Cloud",
    "region": "us-east-1",
    "account_kind": "hm-cloud",
    "account_display_name": "Harness Cloud"
  },
  "recommended_combo_key": "A",
  "checks": [
    {
      "sort_order": 0,
      "label": "repo graph",
      "verdict": "pass",
      "detail": "packages/disputes · 41 files · test map read"
    },
    {
      "sort_order": 1,
      "label": "write scope",
      "verdict": "pass",
      "detail": "3 packages named · none outside"
    },
    {
      "sort_order": 2,
      "label": "criteria mapping",
      "verdict": "pass",
      "detail": "9 of 9 claimed"
    },
    {
      "sort_order": 3,
      "label": "policy retail-na",
      "verdict": "pass",
      "detail": "no external mutation requested"
    }
  ],
  "source_package": {
    "playbook_ref": "workspace/<task-id>/final/PLAYBOOK.md",
    "idag_ref": "workspace/<task-id>/final/DAG.yaml",
    "handoff_ref": "workspace/<task-id>/final/HANDOFF.md",
    "manifest_ref": "workspace/<task-id>/final/PACKAGE_MANIFEST.yaml",
    "quality_gate": "PASS"
  }
}
